{
  "$schema": "../../schemas/roads.schema.json",
  "meta": {
    "updatedAt": "2026-08-26",
    "fields": {
      "publicPrice": {
        "updateMode": "manual",
        "label": "What the state pays for one unit, from the audit or the agency's own plan",
        "url": "https://oig.nasa.gov/",
        "maxAgeDays": 400,
        "updatedAt": "2026-08-26",
        "note": "Each item carries its own source. Prefer an inspector general, an auditor, or the agency's own published plan over a news report. A programme cost moves when the plan is revised, not on a schedule, so record the year in the note."
      },
      "privatePrice": {
        "updateMode": "manual",
        "label": "What a market actor charges for the same one unit",
        "url": "https://www.spacex.com/",
        "maxAgeDays": 400,
        "updatedAt": "2026-08-26",
        "note": "Each item carries its own source. Prefer a published price list over an estimate. Where the private actor took public money, say so in the note; do not quietly net it out."
      },
      "figure": {
        "updateMode": "manual",
        "label": "Counts and shares that stand on their own, with no arithmetic applied",
        "url": "https://foundation.caionline.org/publications/factbook/statistical-review/",
        "maxAgeDays": 400,
        "updatedAt": "2026-08-26",
        "note": "Printed exactly as written. Each item carries its own source. Re-sample when the publisher issues a new edition, not on the calendar."
      }
    }
  },
  "lede": "You asked about the roads. Start with the size of the bill: roads, rail and air together were {transportShare} of federal spending last year. Then ask who else has ever done these jobs. In every case below, somebody already has.",
  "caveat": "These are not laboratory comparisons, and this page will not pretend otherwise. Two projects are never built to one specification, on one terrain, under one set of rules. A public price usually carries costs a private one does not: land taken by force of law, wages set by statute, and the review process that permits the work. A private price sometimes rests on public money, public research, or a public launch pad. Private roads and private guards mostly serve the people who pay for them, which is the whole objection to them. Every note above names the specific weakness in its own comparison. The claim here is narrow and it is the only one worth making: none of these jobs needs a state to get done, and the state does not do them cheaply.",
  "groups": [
    {
      "id": "bill",
      "title": "The roads are not the bill",
      "lede": "Before asking who would build them, look at what share of your money goes anywhere near them."
    },
    {
      "id": "ground",
      "title": "Who builds the roads",
      "lede": "The question in its original form. It was answered once in America and is being answered now in Sweden. The state's own flagship road answered it a third way."
    },
    {
      "id": "commons",
      "title": "Who keeps the commons",
      "lede": "Roads, parks, lighting, drainage and rubbish. The shared things nobody owns alone, which is meant to be the hardest case of all."
    },
    {
      "id": "guard",
      "title": "Who stands guard",
      "lede": "Protection is the one job almost everybody grants the state. Americans already buy most of theirs on the open market."
    },
    {
      "id": "air",
      "title": "Running the sky",
      "lede": "Air traffic control and access to orbit. Two jobs written off as too big, too dangerous and too unprofitable for anyone but a state."
    }
  ],
  "items": [
    {
      "id": "transport-share",
      "group": "bill",
      "kind": "record",
      "figure": "1.82%",
      "label": "of all federal spending went to roads, rail and air",
      "note": "The Department of Transportation spent $127.6 billion of the $7.01 trillion that went out in the 2025 fiscal year. Everything people picture when they say roads and bridges is under two cents of the dollar.",
      "source": {
        "label": "Monthly Treasury Statement, table 5, FY2025",
        "url": "https://fiscaldata.treasury.gov/datasets/monthly-treasury-statement/outlays-of-the-u-s-government"
      }
    },
    {
      "id": "your-roads-share",
      "group": "bill",
      "kind": "reader",
      "compute": "roads-share",
      "label": "of everything you hand over, at the transport share",
      "note": "This is the transport slice of the donut above, pulled out and set on its own. It is what the roads answer is actually worth as a defence of the rest of the bill.",
      "source": {
        "label": "Monthly Treasury Statement, table 5, FY2025",
        "url": "https://fiscaldata.treasury.gov/datasets/monthly-treasury-statement/outlays-of-the-u-s-government"
      }
    },
    {
      "id": "turnpikes",
      "group": "ground",
      "kind": "record",
      "figure": "2,000+",
      "label": "private companies built America's first road network",
      "note": "Between the 1790s and the 1840s more than two thousand private turnpike companies laid over 10,000 miles of road across the eastern states. They were financed by subscription, not by tax. This is how America got its roads before anyone thought to ask who else would.",
      "source": {
        "label": "Klein and Majewski, Turnpikes and Toll Roads in Nineteenth-Century America, EH.net",
        "url": "https://eh.net/encyclopedia/turnpikes-and-toll-roads-in-nineteenth-century-america/"
      }
    },
    {
      "id": "sweden-private-roads",
      "group": "ground",
      "kind": "record",
      "figure": "284,000 km",
      "label": "of Sweden's roads are private, against 98,000 km run by the state",
      "note": "Around 60,000 private road associations own and maintain roughly two thirds of the Swedish road network. Neighbours organise, levy their own dues and hire the work. Some take a state subsidy in return for public access; most do not. This is not history. It is how Sweden runs today.",
      "source": {
        "label": "Trafikverket, enskilda vägar",
        "url": "https://www.trafikverket.se/resa-och-trafik/vag/enskilda-vagar/"
      }
    },
    {
      "id": "interstate-overrun",
      "group": "ground",
      "kind": "record",
      "figure": "16 years",
      "label": "late, on the road network people name first when they defend the tax",
      "note": "In 1955 the Bureau of Public Roads told Congress the Interstate system would cost $27 billion and open by 1975. The last stretch opened in 1991. This is not a market comparison and is not filed as one. It is the government's own promise against its own outcome. The card quotes the schedule, not a cost ratio, and the reason matters: the $27 billion was quoted in 1955 dollars and the $114 billion finally spent was counted as it was spent, through 1991. Those are not the same dollars, so dividing one by the other would overstate the overrun. The dates need no such adjustment. Both figures come from the FHWA's own history of the programme.",
      "source": {
        "label": "FHWA highway history, Target: $27 Billion, and the system as built",
        "url": "https://www.fhwa.dot.gov/infrastructure/target.cfm"
      }
    },
    {
      "id": "community-associations",
      "group": "commons",
      "kind": "record",
      "figure": "78.1 million",
      "label": "Americans already chose who maintains their commons",
      "note": "You read the dues before you buy, and you can sell and leave. Tax offers neither choice. 373,000 community associations raise $112 billion a year from their own members and spend it on roads, drainage, lighting, parks, water and security. Say the weakness plainly: once you own, the dues are compulsory, the association can place a lien on your home, and it exists under a state enabling statute. The claim here is narrow. It is about consent at the door, not about a gentler collector.",
      "source": {
        "label": "Foundation for Community Association Research, 2025 Statistical Review",
        "url": "https://foundation.caionline.org/publications/factbook/statistical-review/"
      }
    },
    {
      "id": "guards-outnumber-police",
      "group": "guard",
      "kind": "record",
      "figure": "1.9 to 1",
      "label": "private security officers outnumber sworn police",
      "note": "The Bureau of Labor Statistics counts 1,272,400 security guards against 674,910 police officers. Most of the protection Americans actually receive, at the shop, the office, the hospital and the gated street, is already bought rather than taxed for.",
      "source": {
        "label": "BLS, Occupational Employment and Wage Statistics",
        "url": "https://www.bls.gov/news.release/ocwage.t01.htm"
      }
    },
    {
      "id": "patrol-hour",
      "group": "guard",
      "kind": "multiple",
      "publicPrice": 40,
      "privatePrice": 24,
      "label": "as much, per hour of contracted neighbourhood patrol",
      "sameness": "One buyer, one beat, one job: the Sharpstown Civic Association in Houston pays for patrol of the same 7,000 homes, and in 2012 it changed supplier on price.",
      "note": "Harris County constables charged the association about {public} an hour. SEAL Security charged about {private} an hour, and the association got more officers on the street for less money. PolitiFact checked this and threw out the viral version: Sharpstown never fired a police force, and Houston police still answer its 911 calls. This is the fact-checked remainder, which is the only part worth quoting.",
      "publicSource": {
        "label": "PolitiFact, Not so fast: cops fired, private security hired, March 2015",
        "url": "https://politifact.com/article/2015/mar/08/not-so-fast-cops-fired-private-security-hired-crim/"
      },
      "privateSource": {
        "label": "Texas Monthly, on the Sharpstown security contract",